14740,"Bremerton-Silverdale-Port Orchard, WA Metro Area",271473,2019
14860,"Bridgeport-Stamford-Norwalk, CT Metro Area",943332,2019
15180,"Brownsville-Harlingen, TX Metro Area",423163,2019
15260,"Brunswick, GA Metro Area",119122,2019
15380,"Buffalo-Cheektowaga, NY Metro Area",1127983,2019
15500,"Burlington, NC Metro Area",169509,2019
15540,"Burlington-South Burlington, VT Metro Area",219433,2019
15680,"California-Lexington Park, MD Metro Area",113510,2019
15940,"Canton-Massillon, OH Metro Area",397520,2019
15980,"Cape Coral-Fort Myers, FL Metro Area",770577,2019
16020,"Cape Girardeau, MO-IL Metro Area",93397,2019
16060,"Carbondale-Marion, IL Metro Area",137159,2019
16180,"Carson City, NV Metro Area",55916,2019
16220,"Casper, WY Metro Area",79858,2019
16300,"Cedar Rapids, IA Metro Area",273032,2019
16500,"Centralia, WA Micro Area",80707,2019
16540,"Chambersburg-Waynesboro, PA Metro Area",155027,2019
16580,"Champaign-Urbana, IL Metro Area",226033,2019
16620,"Charleston, WV Metro Area",257814,2019
16700,"Charleston-North Charleston, SC Metro Area",802122,2019
16740,"Charlotte-Concord-Gastonia, NC-SC Metro Area",2636883,2019
16820,"Charlottesville, VA Metro Area",218358,2019
16860,"Chattanooga, TN-GA Metro Area",566153,2019
16940,"Cheyenne, WY Metro Area",99500,2019
16980,"Chicago-Naperville-Elgin, IL-IN-WI Metro Area",9457867,2019
17020,"Chico, CA Metro Area",219186,2019
17060,"Chillicothe, OH Micro Area",76666,2019
17140,"Cincinnati, OH-KY-IN Metro Area",2219750,2019
17220,"Clarksburg, WV Micro Area",91707,2019
17300,"Clarksville, TN-KY Metro Area",311073,2019
17340,"Clearlake, CA Micro Area",64386,2019
17420,"Cleveland, TN Metro Area",126801,2019
17460,"Cleveland-Elyria, OH Metro Area",2048449,2019
17660,"Coeur d'Alene, ID Metro Area",165697,2019
17780,"College Station-Bryan, TX Metro Area",268101,2019
17820,"Colorado Springs, CO Metro Area",745791,2019
17860,"Columbia, MO Metro Area",208548,2019
17900,"Columbia, SC Metro Area",839039,2019
17980,"Columbus, GA-AL Metro Area",322103,2019
18020,"Columbus, IN Metro Area",83779,2019
18140,"Columbus, OH Metro Area",2122271,2019
18180,"Concord, NH Micro Area",151391,2019
18260,"Cookeville, TN Micro Area",115274,2019
18300,"Coos Bay, OR Micro Area",64487,2019
18500,"Corning, NY Micro Area",95379,2019
18580,"Corpus Christi, TX Metro Area",429024,2019
18700,"Corvallis, OR Metro Area",93053,2019
18880,"Crestview-Fort Walton Beach-Destin, FL Metro Area",284809,2019
18980,"Cullman, AL Micro Area",83768,2019
19060,"Cumberland, MD-WV Metro Area",97284,2019
19100,"Dallas-Fort Worth-Arlington, TX Metro Area",7573136,2019
19140,"Dalton, GA Metro Area",144724,2019
19180,"Danville, IL Metro Area",75758,2019
19260,"Danville, VA Micro Area",100398,2019
19300,"Daphne-Fairhope-Foley, AL Metro Area",223234,2019
19340,"Davenport-Moline-Rock Island, IA-IL Metro Area",378923,2019
19430,"Dayton-Kettering, OH Metro Area",807611,2019
19460,"Decatur, AL Metro Area",152603,2019
19500,"Decatur, IL Metro Area",104009,2019
19660,"Deltona-Daytona Beach-Ormond Beach, FL Metro Area",668365,2019
19740,"Denver-Aurora-Lakewood, CO Metro Area",2967239,2019
19780,"Des Moines-West Des Moines, IA Metro Area",699292,2019
19820,"Detroit-Warren-Dearborn, MI Metro Area",4319629,2019
20020,"Dothan, AL Metro Area",149358,2019
20100,"Dover, DE Metro Area",180786,2019
20140,"Dublin, GA Micro Area",66343,2019
20180,"DuBois, PA Micro Area",79255,2019
20220,"Dubuque, IA Metro Area",97311,2019
20260,"Duluth, MN-WI Metro Area",289383,2019
20500,"Durham-Chapel Hill, NC Metro Area",644367,2019
20700,"East Stroudsburg, PA Metro Area",170271,2019
20740,"Eau Claire, WI Metro Area",169304,2019
20940,"El Centro, CA Metro Area",181215,2019
21060,"Elizabethtown-Fort Knox, KY Metro Area",154713,2019
21140,"Elkhart-Goshen, IN Metro Area",206341,2019
21300,"Elmira, NY Metro Area",83456,2019
21340,"El Paso, TX Metro Area",843725,2019
21420,"Enid, OK Metro Area",61056,2019
21500,"Erie, PA Metro Area",269728,2019
21660,"Eugene-Springfield, OR Metro Area",382067,2019
21700,"Eureka-Arcata, CA Micro Area",135558,2019
21780,"Evansville, IN-KY Metro Area",315086,2019
21820,"Fairbanks, AK Metro Area",96849,2019
22020,"Fargo, ND-MN Metro Area",246145,2019
22060,"Faribault-Northfield, MN Micro Area",66972,2019
22100,"Farmington, MO Micro Area",67215,2019
22140,"Farmington, NM Metro Area",123958,2019
22180,"Fayetteville, NC Metro Area",526719,2019
22220,"Fayetteville-Springdale-Rogers, AR Metro Area",536120,2019
22300,"Findlay, OH Micro Area",75783,2019
22380,"Flagstaff, AZ Metro Area",143476,2019
22420,"Flint, MI Metro Area",405813,2019
22500,"Florence, SC Metro Area",204911,2019
22520,"Florence-Muscle Shoals, AL Metro Area",147970,2019
22540,"Fond du Lac, WI Metro Area",103403,2019
22580,"Forest City, NC Micro Area",67029,2019
22660,"Fort Collins, CO Metro Area",356899,2019
22840,"Fort Payne, AL Micro Area",71513,2019
22900,"Fort Smith, AR-OK Metro Area",249152,2019
23060,"Fort Wayne, IN Metro Area",413263,2019
23180,"Frankfort, KY Micro Area",73738,2019
23420,"Fresno, CA Metro Area",999101,2019
23460,"Gadsden, AL Metro Area",102268,2019
23540,"Gainesville, FL Metro Area",328517,2019
23580,"Gainesville, GA Metro Area",204441,2019
23700,"Gallup, NM Micro Area",71367,2019
23900,"Gettysburg, PA Metro Area",103009,2019
24020,"Glens Falls, NY Metro Area",125148,2019
24060,"Glenwood Springs, CO Micro Area",79002,2019
24140,"Goldsboro, NC Metro Area",123131,2019
24220,"Grand Forks, ND-MN Metro Area",100815,2019
24260,"Grand Island, NE Metro Area",75553,2019
24300,"Grand Junction, CO Metro Area",154210,2019
24340,"Grand Rapids-Kentwood, MI Metro Area",1077370,2019
24420,"Grants Pass, OR Metro Area",87487,2019
24500,"Great Falls, MT Metro Area",81366,2019
24540,"Greeley, CO Metro Area",324492,2019
24580,"Green Bay, WI Metro Area",322906,2019
24620,"Greeneville, TN Micro Area",69069,2019
24660,"Greensboro-High Point, NC Metro Area",771851,2019
24780,"Greenville, NC Metro Area",180742,2019
24860,"Greenville-Anderson, SC Metro Area",920477,2019
24940,"Greenwood, SC Micro Area",70811,2019
25020,"Guayama, PR Metro Area",69845,2019
25060,"Gulfport-Biloxi, MS Metro Area",417665,2019
25180,"Hagerstown-Martinsburg, MD-WV Metro Area",289545,2019
25220,"Hammond, LA Metro Area",134758,2019
25260,"Hanford-Corcoran, CA Metro Area",152940,2019
25420,"Harrisburg-Carlisle, PA Metro Area",577941,2019
25500,"Harrisonburg, VA Metro Area",134964,2019
25540,"Hartford-East Hartford-Middletown, CT Metro Area",1204877,2019
25620,"Hattiesburg, MS Metro Area",168469,2019
25720,"Heber, UT Micro Area",76236,2019
25740,"Helena, MT Micro Area",81293,2019
25840,"Hermiston-Pendleton, OR Micro Area",88499,2019
25860,"Hickory-Lenoir-Morganton, NC Metro Area",369711,2019
25900,"Hilo, HI Micro Area",201513,2019
25940,"Hilton Head Island-Bluffton, SC Metro Area",222195,2019
25980,"Hinesville, GA Metro Area",81344,2019
26020,"Hobbs, NM Micro Area",71070,2019
26090,"Holland, MI Micro Area",118081,2019
26140,"Homosassa Springs, FL Metro Area",149657,2019
26300,"Hot Springs, AR Metro Area",99386,2019
26380,"Houma-Thibodaux, LA Metro Area",208075,2019
26420,"Houston-The Woodlands-Sugar Land, TX Metro Area",7066140,2019
26580,"Huntington-Ashland, WV-KY-OH Metro Area",355873,2019
26620,"Huntsville, AL Metro Area",471824,2019
26660,"Huntsville, TX Micro Area",72971,2019
26740,"Hutchinson, KS Micro Area",61998,2019
26820,"Idaho Falls, ID Metro Area",151516,2019
26860,"Indiana, PA Micro Area",84073,2019
26900,"Indianapolis-Carmel-Anderson, IN Metro Area",2076531,2019
26980,"Iowa City, IA Metro Area",173105,2019
27060,"Ithaca, NY Metro Area",102180,2019
27100,"Jackson, MI Metro Area",158510,2019
27140,"Jackson, MS Metro Area",594800,2019
27180,"Jackson, TN Metro Area",178644,2019
27260,"Jacksonville, FL Metro Area",1559514,2019
27340,"Jacksonville, NC Metro Area",197938,2019
27460,"Jamestown-Dunkirk-Fredonia, NY Micro Area",126903,2019
27500,"Janesville-Beloit, WI Metro Area",163354,2019
27600,"Jefferson, GA Micro Area",72977,2019
27620,"Jefferson City, MO Metro Area",151418,2019
27740,"Johnson City, TN Metro Area",203697,2019
27780,"Johnstown, PA Metro Area",130192,2019
27860,"Jonesboro, AR Metro Area",133860,2019
27900,"Joplin, MO Metro Area",179564,2019
27980,"Kahului-Wailuku-Lahaina, HI Metro Area",167488,2019
28020,"Kalamazoo-Portage, MI Metro Area",265066,2019
28060,"Kalispell, MT Micro Area",103806,2019
28100,"Kankakee, IL Metro Area",109862,2019
28140,"Kansas City, MO-KS Metro Area",2155068,2019
28180,"Kapaa, HI Micro Area",72293,2019
28300,"Keene, NH Micro Area",76085,2019
28420,"Kennewick-Richland, WA Metro Area",299612,2019
28580,"Key West, FL Micro Area",74228,2019
28660,"Killeen-Temple, TX Metro Area",460993,2019
28700,"Kingsport-Bristol, TN-VA Metro Area",307707,2019
28740,"Kingston, NY Metro Area",177573,2019
28900,"Klamath Falls, OR Micro Area",68238,2019
28940,"Knoxville, TN Metro Area",869525,2019
29020,"Kokomo, IN Metro Area",82544,2019
29100,"La Crosse-Onalaska, WI-MN Metro Area",136616,2019
29180,"Lafayette, LA Metro Area",489207,2019
29200,"Lafayette-West Lafayette, IN Metro Area",233674,2019
29300,"LaGrange, GA-AL Micro Area",103176,2019
29340,"Lake Charles, LA Metro Area",209035,2019
29380,"Lake City, FL Micro Area",71686,2019
29420,"Lake Havasu City-Kingman, AZ Metro Area",212181,2019
29460,"Lakeland-Winter Haven, FL Metro Area",724777,2019
29540,"Lancaster, PA Metro Area",545724,2019
29620,"Lansing-East Lansing, MI Metro Area",550391,2019
29700,"Laredo, TX Metro Area",276652,2019
29740,"Las Cruces, NM Metro Area",218195,2019
29820,"Las Vegas-Henderson-Paradise, NV Metro Area",2266715,2019
29860,"Laurel, MS Micro Area",83118,2019
29940,"Lawrence, KS Metro Area",122259,2019
30020,"Lawton, OK Metro Area",126043,2019
30100,"Lebanon, NH-VT Micro Area",216986,2019
30140,"Lebanon, PA Metro Area",141793,2019
30300,"Lewiston, ID-WA Metro Area",62990,2019
30340,"Lewiston-Auburn, ME Metro Area",108277,2019
30460,"Lexington-Fayette, KY Metro Area",517056,2019
30620,"Lima, OH Metro Area",102351,2019
30700,"Lincoln, NE Metro Area",336541,2019
30780,"Little Rock-North Little Rock-Conway, AR Metro Area",744483,2019
30860,"Logan, UT-ID Metro Area",141760,2019
30940,"London, KY Micro Area",148176,2019
30980,"Longview, TX Metro Area",286657,2019
31020,"Longview, WA Metro Area",110593,2019
31080,"Los Angeles-Long Beach-Anaheim, CA Metro Area",13214799,2019
31140,"Louisville/Jefferson County, KY-IN Metro Area",1266389,2019
31180,"Lubbock, TX Metro Area",321982,2019
31260,"Lufkin, TX Micro Area",86715,2019
31300,"Lumberton, NC Micro Area",130625,2019
31340,"Lynchburg, VA Metro Area",266186,2019
31420,"Macon-Bibb County, GA Metro Area",231130,2019
31460,"Madera, CA Metro Area",157327,2019
31540,"Madison, WI Metro Area",664865,2019
31700,"Manchester-Nashua, NH Metro Area",417025,2019
31740,"Manhattan, KS Metro Area",130285,2019
31820,"Manitowoc, WI Micro Area",78981,2019
31860,"Mankato, MN Metro Area",101927,2019
31900,"Mansfield, OH Metro Area",121154,2019
31940,"Marinette, WI-MI Micro Area",63130,2019
31980,"Marion, IN Micro Area",65769,2019
32020,"Marion, OH Micro Area",65093,2019
32100,"Marquette, MI Micro Area",66699,2019
32300,"Martinsville, VA Micro Area",62934,2019
32420,"Mayagez, PR Metro Area",94806,2019
32580,"McAllen-Edinburg-Mission, TX Metro Area",868707,2019
32740,"Meadville, PA Micro Area",84629,2019
32780,"Medford, OR Metro Area",220944,2019
32820,"Memphis, TN-MS-AR Metro Area",1344910,2019
32900,"Merced, CA Metro Area",277680,2019
32940,"Meridian, MS Micro Area",99690,2019
33100,"Miami-Fort Lauderdale-Pompano Beach, FL Metro Area",6166488,2019
33140,"Michigan City-La Porte, IN Metro Area",109888,2019
33220,"Midland, MI Metro Area",83156,2019
33260,"Midland, TX Metro Area",182782,2019
33340,"Milwaukee-Waukesha, WI Metro Area",1575179,2019
33460,"Minneapolis-St. Paul-Bloomington, MN-WI Metro Area",3640043,2019
33500,"Minot, ND Micro Area",74938,2019
33540,"Missoula, MT Metro Area",119600,2019
33660,"Mobile, AL Metro Area",428039,2019
33700,"Modesto, CA Metro Area",550660,2019
33740,"Monroe, LA Metro Area",200261,2019
33780,"Monroe, MI Metro Area",150500,2019
33860,"Montgomery, AL Metro Area",372809,2019
33980,"Morehead City, NC Micro Area",69473,2019
34060,"Morgantown, WV Metro Area",139044,2019
34100,"Morristown, TN Metro Area",142749,2019
34180,"Moses Lake, WA Micro Area",97733,2019
34340,"Mount Airy, NC Micro Area",71783,2019
34380,"Mount Pleasant, MI Micro Area",69872,2019
34580,"Mount Vernon-Anacortes, WA Metro Area",129205,2019
34620,"Muncie, IN Metro Area",114135,2019
34740,"Muskegon, MI Metro Area",173566,2019
34780,"Muskogee, OK Micro Area",67997,2019
34820,"Myrtle Beach-Conway-North Myrtle Beach, SC-NC Metro Area",496901,2019
34860,"Nacogdoches, TX Micro Area",65204,2019
34900,"Napa, CA Metro Area",137744,2019
34940,"Naples-Marco Island, FL Metro Area",384902,2019
34980,"Nashville-Davidson--Murfreesboro--Franklin, TN Metro Area",1933860,2019
35100,"New Bern, NC Metro Area",127904,2019
35260,"New Castle, PA Micro Area",85512,2019
35300,"New Haven-Milford, CT Metro Area",854757,2019
35380,"New Orleans-Metairie, LA Metro Area",1270530,2019
35420,"New Philadelphia-Dover, OH Micro Area",91987,2019
35620,"New York-Newark-Jersey City, NY-NJ-PA Metro Area",19216182,2019
35660,"Niles, MI Metro Area",153401,2019
35840,"North Port-Sarasota-Bradenton, FL Metro Area",836995,2019
35900,"North Wilkesboro, NC Micro Area",68412,2019
35980,"Norwich-New London, CT Metro Area",265206,2019
36020,"Oak Harbor, WA Micro Area",85141,2019
36100,"Ocala, FL Metro Area",365579,2019
36140,"Ocean City, NJ Metro Area",92039,2019
36220,"Odessa, TX Metro Area",166223,2019
36260,"Ogden-Clearfield, UT Metro Area",683024,2019
36300,"Ogdensburg-Massena, NY Micro Area",107740,2019
36420,"Oklahoma City, OK Metro Area",1408950,2019
36460,"Olean, NY Micro Area",76117,2019
36500,"Olympia-Lacey-Tumwater, WA Metro Area",290536,2019
36540,"Omaha-Council Bluffs, NE-IA Metro Area",949726,2019
36660,"Opelousas, LA Micro Area",82124,2019
36700,"Orangeburg, SC Micro Area",86175,2019
36740,"Orlando-Kissimmee-Sanford, FL Metro Area",2608147,2019
36780,"Oshkosh-Neenah, WI Metro Area",171907,2019
36837,"Ottawa, IL Micro Area",146685,2019
36980,"Owensboro, KY Metro Area",121128,2019
37100,"Oxnard-Thousand Oaks-Ventura, CA Metro Area",846006,2019
37140,"Paducah, KY-IL Micro Area",95748,2019
37260,"Palatka, FL Micro Area",74521,2019
37340,"Palm Bay-Melbourne-Titusville, FL Metro Area",601942,2019
37460,"Panama City, FL Metro Area",174705,2019
37620,"Parkersburg-Vienna, WV Metro Area",89676,2019
37860,"Pensacola-Ferry Pass-Brent, FL Metro Area",502629,2019
37900,"Peoria, IL Metro Area",400912,2019
37980,"Philadelphia-Camden-Wilmington, PA-NJ-DE-MD Metro Area",6102434,2019
38060,"Phoenix-Mesa-Chandler, AZ Metro Area",4948203,2019
38220,"Pine Bluff, AR Metro Area",89437,2019
38240,"Pinehurst-Southern Pines, NC Micro Area",100880,2019
38300,"Pittsburgh, PA Metro Area",2317600,2019
38340,"Pittsfield, MA Metro Area",124944,2019
38460,"Plattsburgh, NY Micro Area",80485,2019
38540,"Pocatello, ID Metro Area",94588,2019
38660,"Ponce, PR Metro Area",217403,2019
38820,"Port Angeles, WA Micro Area",77331,2019
38860,"Portland-South Portland, ME Metro Area",538500,2019
38900,"Portland-Vancouver-Hillsboro, OR-WA Metro Area",2493221,2019
38940,"Port St. Lucie, FL Metro Area",489297,2019
39020,"Portsmouth, OH Micro Area",75314,2019
39060,"Pottsville, PA Micro Area",141359,2019
39100,"Poughkeepsie-Newburgh-Middletown, NY Metro Area",679158,2019
39150,"Prescott Valley-Prescott, AZ Metro Area",235099,2019
39300,"Providence-Warwick, RI-MA Metro Area",1624578,2019
39340,"Provo-Orem, UT Metro Area",649603,2019
39380,"Pueblo, CO Metro Area",168424,2019
39460,"Punta Gorda, FL Metro Area",188910,2019
39500,"Quincy, IL-MO Micro Area",76265,2019
39540,"Racine, WI Metro Area",196311,2019
39580,"Raleigh-Cary, NC Metro Area",1390785,2019
39660,"Rapid City, SD Metro Area",142191,2019
39740,"Reading, PA Metro Area",421164,2019
39780,"Red Bluff, CA Micro Area",65084,2019
39820,"Redding, CA Metro Area",180080,2019
39900,"Reno, NV Metro Area",475290,2019
39980,"Richmond, IN Micro Area",65884,2019
40060,"Richmond, VA Metro Area",1290866,2019
40080,"Richmond-Berea, KY Micro Area",104819,2019
40140,"Riverside-San Bernardino-Ontario, CA Metro Area",4650631,2019
40220,"Roanoke, VA Metro Area",312796,2019
40260,"Roanoke Rapids, NC Micro Area",69493,2019
40340,"Rochester, MN Metro Area",221921,2019
40380,"Rochester, NY Metro Area",1069644,2019
40420,"Rockford, IL Metro Area",336116,2019
40580,"Rocky Mount, NC Metro Area",145770,2019
40660,"Rome, GA Metro Area",98498,2019
40700,"Roseburg, OR Micro Area",110980,2019
40740,"Roswell, NM Micro Area",64615,2019
40780,"Russellville, AR Micro Area",85413,2019
40900,"Sacramento-Roseville-Folsom, CA Metro Area",2363730,2019
40980,"Saginaw, MI Metro Area",190539,2019
41060,"St. Cloud, MN Metro Area",201964,2019
41100,"St. George, UT Metro Area",177556,2019
41140,"St. Joseph, MO-KS Metro Area",125411,2019
41180,"St. Louis, MO-IL Metro Area",2801423,2019
41400,"Salem, OH Micro Area",101883,2019
41420,"Salem, OR Metro Area",433903,2019
41500,"Salinas, CA Metro Area",434061,2019
41540,"Salisbury, MD-DE Metro Area",415726,2019
41620,"Salt Lake City, UT Metro Area",1232696,2019
41660,"San Angelo, TX Metro Area",121376,2019
41700,"San Antonio-New Braunfels, TX Metro Area",2550960,2019
41740,"San Diego-Chula Vista-Carlsbad, CA Metro Area",3338330,2019
41780,"Sandusky, OH Micro Area",74266,2019
41860,"San Francisco-Oakland-Berkeley, CA Metro Area",4731803,2019
41900,"San Germn, PR Metro Area",116646,2019
41940,"San Jose-Sunnyvale-Santa Clara, CA Metro Area",1990660,2019
41980,"San Juan-Bayamn-Caguas, PR Metro Area",2031885,2019
42020,"San Luis Obispo-Paso Robles, CA Metro Area",283111,2019
42100,"Santa Cruz-Watsonville, CA Metro Area",273213,2019
42140,"Santa Fe, NM Metro Area",150358,2019
42200,"Santa Maria-Santa Barbara, CA Metro Area",446499,2019
42220,"Santa Rosa-Petaluma, CA Metro Area",494336,2019
42340,"Savannah, GA Metro Area",393353,2019
42540,"Scranton--Wilkes-Barre, PA Metro Area",553885,2019
42620,"Searcy, AR Micro Area",78753,2019
42660,"Seattle-Tacoma-Bellevue, WA Metro Area",3979845,2019
42680,"Sebastian-Vero Beach, FL Metro Area",159923,2019
42700,"Sebring-Avon Park, FL Metro Area",106221,2019
42860,"Seneca, SC Micro Area",79546,2019
42940,"Sevierville, TN Micro Area",98250,2019
43060,"Shawnee, OK Micro Area",72592,2019
43100,"Sheboygan, WI Metro Area",115340,2019
43140,"Shelby, NC Micro Area",97947,2019
43220,"Shelton, WA Micro Area",66768,2019
43300,"Sherman-Denison, TX Metro Area",136212,2019
43320,"Show Low, AZ Micro Area",110924,2019
43340,"Shreveport-Bossier City, LA Metro Area",394706,2019
43420,"Sierra Vista-Douglas, AZ Metro Area",125922,2019
43580,"Sioux City, IA-NE-SD Metro Area",144670,2019
43620,"Sioux Falls, SD Metro Area",268833,2019
43740,"Somerset, PA Micro Area",73447,2019
43780,"South Bend-Mishawaka, IN-MI Metro Area",323613,2019
43900,"Spartanburg, SC Metro Area",319785,2019
44060,"Spokane-Spokane Valley, WA Metro Area",568521,2019
44100,"Springfield, IL Metro Area",207003,2019
44140,"Springfield, MA Metro Area",697382,2019
44180,"Springfield, MO Metro Area",467516,2019
44220,"Springfield, OH Metro Area",134083,2019
44300,"State College, PA Metro Area",162385,2019
44340,"Statesboro, GA Micro Area",79608,2019
44420,"Staunton, VA Metro Area",123120,2019
44620,"Stevens Point, WI Micro Area",70772,2019
44660,"Stillwater, OK Micro Area",81784,2019
44700,"Stockton, CA Metro Area",762148,2019
44940,"Sumter, SC Metro Area",140466,2019
44980,"Sunbury, PA Micro Area",90843,2019
45060,"Syracuse, NY Metro Area",648593,2019
45180,"Talladega-Sylacauga, AL Micro Area",79978,2019
45220,"Tallahassee, FL Metro Area",386454,2019
45300,"Tampa-St. Petersburg-Clearwater, FL Metro Area",3194831,2019
45460,"Terre Haute, IN Metro Area",185782,2019
45500,"Texarkana, TX-AR Metro Area",149308,2019
45540,"The Villages, FL Metro Area",132420,2019
45780,"Toledo, OH Metro Area",641816,2019
45820,"Topeka, KS Metro Area",231969,2019
45860,"Torrington, CT Micro Area",180333,2019
45900,"Traverse City, MI Micro Area",150653,2019
45940,"Trenton-Princeton, NJ Metro Area",367430,2019
46020,"Truckee-Grass Valley, CA Micro Area",99755,2019
46060,"Tucson, AZ Metro Area",1047279,2019
46100,"Tullahoma-Manchester, TN Micro Area",104382,2019
46140,"Tulsa, OK Metro Area",998655,2019
46180,"Tupelo, MS Micro Area",166126,2019
46220,"Tuscaloosa, AL Metro Area",251836,2019
46300,"Twin Falls, ID Metro Area",109784,2019
46340,"Tyler, TX Metro Area",232751,2019
46380,"Ukiah, CA Micro Area",86749,2019
46520,"Urban Honolulu, HI Metro Area",974563,2019
46540,"Utica-Rome, NY Metro Area",289990,2019
46660,"Valdosta, GA Metro Area",145738,2019
46700,"Vallejo, CA Metro Area",447643,2019
47020,"Victoria, TX Metro Area",99090,2019
47220,"Vineland-Bridgeton, NJ Metro Area",149527,2019
47260,"Virginia Beach-Norfolk-Newport News, VA-NC Metro Area",1765031,2019
47300,"Visalia, CA Metro Area",466195,2019
47380,"Waco, TX Metro Area",270868,2019
47460,"Walla Walla, WA Metro Area",60760,2019
47580,"Warner Robins, GA Metro Area",185409,2019
47700,"Warsaw, IN Micro Area",79456,2019
47900,"Washington-Arlington-Alexandria, DC-VA-MD-WV Metro Area",6280697,2019
47940,"Waterloo-Cedar Falls, IA Metro Area",168522,2019
48020,"Watertown-Fort Atkinson, WI Micro Area",84769,2019
48060,"Watertown-Fort Drum, NY Metro Area",109834,2019
48140,"Wausau-Weston, WI Metro Area",163285,2019
48260,"Weirton-Steubenville, WV-OH Metro Area",115816,2019
48300,"Wenatchee, WA Metro Area",120629,2019
48540,"Wheeling, WV-OH Metro Area",138948,2019
48580,"Whitewater, WI Micro Area",103868,2019
48620,"Wichita, KS Metro Area",640218,2019
48660,"Wichita Falls, TX Metro Area",151254,2019
48700,"Williamsport, PA Metro Area",113299,2019
48900,"Wilmington, NC Metro Area",297533,2019
48980,"Wilson, NC Micro Area",81801,2019
49020,"Winchester, VA-WV Metro Area",139125,2019
49180,"Winston-Salem, NC Metro Area",676008,2019
49220,"Wisconsin Rapids-Marshfield, WI Micro Area",72999,2019
49300,"Wooster, OH Micro Area",115710,2019
49340,"Worcester, MA-CT Metro Area",947404,2019
49420,"Yakima, WA Metro Area",250873,2019
49500,"Yauco, PR Metro Area",89949,2019
49620,"York-Hanover, PA Metro Area",449058,2019
49660,"Youngstown-Warren-Boardman, OH-PA Metro Area",536081,2019
49700,"Yuba City, CA Metro Area",175639,2019
49740,"Yuma, AZ Metro Area",213787,2019
49780,"Zanesville, OH Micro Area",86215,2019
10140,"Aberdeen, WA Micro Area",76841,2021
10180,"Abilene, TX Metro Area",178608,2021
10300,"Adrian, MI Micro Area",98956,2021
10380,"Aguadilla-Isabela, PR Metro Area",309515,2021
10420,"Akron, OH Metro Area",700015,2021
10460,"Alamogordo, NM Micro Area",68537,2021
10500,"Albany, GA Metro Area",146961,2021
10540,"Albany-Lebanon, OR Metro Area",129839,2021
10580,"Albany-Schenectady-Troy, NY Metro Area",899286,2021
10700,"Albertville, AL Micro Area",98228,2021
10740,"Albuquerque, NM Metro Area",921311,2021
10780,"Alexandria, LA Metro Area",150890,2021
10900,"Allentown-Bethlehem-Easton, PA-NJ Metro Area",865310,2021
11020,"Altoona, PA Metro Area",121767,2021
11100,"Amarillo, TX Metro Area",270119,2021
11180,"Ames, IA Metro Area",126195,2021
11260,"Anchorage, AK Metro Area",398807,2021
11460,"Ann Arbor, MI Metro Area",369390,2021
11500,"Anniston-Oxford, AL Metro Area",115972,2021
11540,"Appleton, WI Metro Area",244084,2021
11640,"Arecibo, PR Metro Area",182014,2021
11700,"Asheville, NC Metro Area",472341,2021
11780,"Ashtabula, OH Micro Area",97337,2021
11980,"Athens, TX Micro Area",83667,2021
12020,"Athens-Clarke County, GA Metro Area",217382,2021
12060,"Atlanta-Sandy Springs-Alpharetta, GA Metro Area",6144970,2021
12100,"Atlantic City-Hammonton, NJ Metro Area",274966,2021
12180,"Auburn, NY Micro Area",75880,2021
12220,"Auburn-Opelika, AL Metro Area",177218,2021
12260,"Augusta-Richmond County, GA-SC Metro Area",616395,2021
12300,"Augusta-Waterville, ME Micro Area",124486,2021
12420,"Austin-Round Rock-Georgetown, TX Metro Area",2352426,2021
12540,"Bakersfield, CA Metro Area",917673,2021
12580,"Baltimore-Columbia-Towson, MD Metro Area",2838327,2021
12620,"Bangor, ME Metro Area",152765,2021
12660,"Baraboo, WI Micro Area",65697,2021
12700,"Barnstable Town, MA Metro Area",232411,2021
12940,"Baton Rouge, LA Metro Area",871905,2021
12980,"Battle Creek, MI Metro Area",133819,2021
13020,"Bay City, MI Metro Area",102985,2021
13140,"Beaumont-Port Arthur, TX Metro Area",395419,2021
13180,"Beaver Dam, WI Micro Area",89313,2021
13220,"Beckley, WV Metro Area",113698,2021
13380,"Bellingham, WA Metro Area",228831,2021
13460,"Bend, OR Metro Area",204801,2021
13740,"Billings, MT Metro Area",187037,2021
13780,"Binghamton, NY Metro Area",245220,2021
13820,"Birmingham-Hoover, AL Metro Area",1114262,2021
13900,"Bismarck, ND Metro Area",134028,2021
13980,"Blacksburg-Christiansburg, VA Metro Area",168404,2021
14010,"Bloomington, IL Metro Area",170889,2021
14020,"Bloomington, IN Metro Area",161321,2021
14100,"Bloomsburg-Berwick, PA Metro Area",82959,2021
14140,"Bluefield, WV-VA Micro Area",104994,2021
14260,"Boise City, ID Metro Area",801470,2021
14460,"Boston-Cambridge-Newton, MA-NH Metro Area",4899932,2021
14500,"Boulder, CO Metro Area",329543,2021
14540,"Bowling Green, KY Metro Area",186107,2021
14580,"Bozeman, MT Micro Area",122713,2021
14660,"Brainerd, MN Micro Area",97909,2021
14740,"Bremerton-Silverdale-Port Orchard, WA Metro Area",274314,2021
14860,"Bridgeport-Stamford-Norwalk, CT Metro Area",959768,2021
15180,"Brownsville-Harlingen, TX Metro Area",423029,2021
15260,"Brunswick, GA Metro Area",115033,2021
15380,"Buffalo-Cheektowaga, NY Metro Area",1162336,2021
15500,"Burlington, NC Metro Area",173877,2021
15540,"Burlington-South Burlington, VT Metro Area",226715,2021
15680,"California-Lexington Park, MD Metro Area",114468,2021
15940,"Canton-Massillon, OH Metro Area",400525,2021
15980,"Cape Coral-Fort Myers, FL Metro Area",787976,2021
