11780,"Ashtabula, OH Micro Area",98632,2015
11900,"Athens, OH Micro Area",65886,2015
11980,"Athens, TX Micro Area",79545,2015
12020,"Athens-Clarke County, GA Metro Area",201813,2015
12060,"Atlanta-Sandy Springs-Roswell, GA Metro Area",5709731,2015
12100,"Atlantic City-Hammonton, NJ Metro Area",274219,2015
12180,"Auburn, NY Micro Area",78288,2015
12220,"Auburn-Opelika, AL Metro Area",156993,2015
12260,"Augusta-Richmond County, GA-SC Metro Area",590772,2015
12300,"Augusta-Waterville, ME Micro Area",119980,2015
12420,"Austin-Round Rock, TX Metro Area",2000860,2015
12540,"Bakersfield, CA Metro Area",882176,2015
12580,"Baltimore-Columbia-Towson, MD Metro Area",2797407,2015
12620,"Bangor, ME Metro Area",152692,2015
12700,"Barnstable Town, MA Metro Area",214333,2015
12940,"Baton Rouge, LA Metro Area",830480,2015
12980,"Battle Creek, MI Metro Area",134314,2015
13020,"Bay City, MI Metro Area",105659,2015
13140,"Beaumont-Port Arthur, TX Metro Area",408216,2015
13180,"Beaver Dam, WI Micro Area",88502,2015
13220,"Beckley, WV Metro Area",122507,2015
13380,"Bellingham, WA Metro Area",212284,2015
13460,"Bend-Redmond, OR Metro Area",175268,2015
13740,"Billings, MT Metro Area",169329,2015
13780,"Binghamton, NY Metro Area",246020,2015
13820,"Birmingham-Hoover, AL Metro Area",1145647,2015
13900,"Bismarck, ND Metro Area",129640,2015
13980,"Blacksburg-Christiansburg-Radford, VA Metro Area",179904,2015
14010,"Bloomington, IL Metro Area",188725,2015
14020,"Bloomington, IN Metro Area",165577,2015
14100,"Bloomsburg-Berwick, PA Metro Area",85229,2015
14140,"Bluefield, WV-VA Micro Area",104063,2015
14260,"Boise City, ID Metro Area",675800,2015
14460,"Boston-Cambridge-Newton, MA-NH Metro Area",4774321,2015
14500,"Boulder, CO Metro Area",319372,2015
14540,"Bowling Green, KY Metro Area",166890,2015
14580,"Bozeman, MT Micro Area",100739,2015
14660,"Brainerd, MN Micro Area",92134,2015
14700,"Branson, MO Micro Area",85535,2015
14740,"Bremerton-Silverdale, WA Metro Area",260131,2015
14860,"Bridgeport-Stamford-Norwalk, CT Metro Area",948053,2015
15180,"Brownsville-Harlingen, TX Metro Area",422156,2015
15260,"Brunswick, GA Metro Area",117771,2015
15380,"Buffalo-Cheektowaga-Niagara Falls, NY Metro Area",1135230,2015
15500,"Burlington, NC Metro Area",158276,2015
15540,"Burlington-South Burlington, VT Metro Area",216661,2015
15680,"California-Lexington Park, MD Metro Area",111413,2015
15940,"Canton-Massillon, OH Metro Area",402976,2015
15980,"Cape Coral-Fort Myers, FL Metro Area",701982,2015
16020,"Cape Girardeau, MO-IL Metro Area",96542,2015
16060,"Carbondale-Marion, IL Metro Area",126828,2015
16180,"Carson City, NV Metro Area",54521,2015
16220,"Casper, WY Metro Area",82178,2015
16300,"Cedar Rapids, IA Metro Area",266040,2015
16500,"Centralia, WA Micro Area",75882,2015
16540,"Chambersburg-Waynesboro, PA Metro Area",153638,2015
16580,"Champaign-Urbana, IL Metro Area",239672,2015
16620,"Charleston, WV Metro Area",219236,2015
16660,"Charleston-Mattoon, IL Micro Area",62998,2015
16700,"Charleston-North Charleston, SC Metro Area",744526,2015
16740,"Charlotte-Concord-Gastonia, NC-SC Metro Area",2426363,2015
16820,"Charlottesville, VA Metro Area",230602,2015
16860,"Chattanooga, TN-GA Metro Area",546351,2015
16940,"Cheyenne, WY Metro Area",97121,2015
16980,"Chicago-Naperville-Elgin, IL-IN-WI Metro Area",9550108,2015
17020,"Chico, CA Metro Area",225411,2015
17060,"Chillicothe, OH Micro Area",77170,2015
17140,"Cincinnati, OH-KY-IN Metro Area",2159329,2015
17200,"Claremont-Lebanon, NH-VT Micro Area",216923,2015
17220,"Clarksburg, WV Micro Area",91756,2015
17300,"Clarksville, TN-KY Metro Area",279887,2015
17340,"Clearlake, CA Micro Area",64591,2015
17420,"Cleveland, TN Metro Area",121678,2015
17460,"Cleveland-Elyria, OH Metro Area",2060810,2015
17660,"Coeur d'Alene, ID Metro Area",150346,2015
17780,"College Station-Bryan, TX Metro Area",250145,2015
17820,"Colorado Springs, CO Metro Area",697856,2015
17860,"Columbia, MO Metro Area",174974,2015
17900,"Columbia, SC Metro Area",810574,2015
17980,"Columbus, GA-AL Metro Area",312936,2015
18020,"Columbus, IN Metro Area",81162,2015
18140,"Columbus, OH Metro Area",2021632,2015
18180,"Concord, NH Micro Area",147994,2015
18260,"Cookeville, TN Micro Area",107851,2015
18300,"Coos Bay, OR Micro Area",63121,2015
18500,"Corning, NY Micro Area",97631,2015
18580,"Corpus Christi, TX Metro Area",450436,2015
18700,"Corvallis, OR Metro Area",87572,2015
18880,"Crestview-Fort Walton Beach-Destin, FL Metro Area",262172,2015
18980,"Cullman, AL Micro Area",82005,2015
19060,"Cumberland, MD-WV Metro Area",99979,2015
19100,"Dallas-Fort Worth-Arlington, TX Metro Area",7102165,2015
19140,"Dalton, GA Metro Area",143781,2015
19180,"Danville, IL Metro Area",79282,2015
19260,"Danville, VA Micro Area",104276,2015
19300,"Daphne-Fairhope-Foley, AL Metro Area",203709,2015
19340,"Davenport-Moline-Rock Island, IA-IL Metro Area",384584,2015
19380,"Dayton, OH Metro Area",800909,2015
19460,"Decatur, AL Metro Area",152680,2015
19500,"Decatur, IL Metro Area",107303,2015
19660,"Deltona-Daytona Beach-Ormond Beach, FL Metro Area",623279,2015
19740,"Denver-Aurora-Lakewood, CO Metro Area",2814330,2015
19780,"Des Moines-West Des Moines, IA Metro Area",622899,2015
19820,"Detroit-Warren-Dearborn, MI Metro Area",4302043,2015
20020,"Dothan, AL Metro Area",148171,2015
20100,"Dover, DE Metro Area",173533,2015
20180,"DuBois, PA Micro Area",80994,2015
20220,"Dubuque, IA Metro Area",97125,2015
20260,"Duluth, MN-WI Metro Area",279601,2015
20380,"Dunn, NC Micro Area",128140,2015
20500,"Durham-Chapel Hill, NC Metro Area",552493,2015
20700,"East Stroudsburg, PA Metro Area",166397,2015
20740,"Eau Claire, WI Metro Area",165636,2015
20940,"El Centro, CA Metro Area",180191,2015
21020,"Elizabeth City, NC Micro Area",63938,2015
21060,"Elizabethtown-Fort Knox, KY Metro Area",147877,2015
21140,"Elkhart-Goshen, IN Metro Area",203474,2015
21300,"Elmira, NY Metro Area",87071,2015
21340,"El Paso, TX Metro Area",838019,2015
21500,"Erie, PA Metro Area",278045,2015
21660,"Eugene, OR Metro Area",362895,2015
21700,"Eureka-Arcata-Fortuna, CA Micro Area",135727,2015
21780,"Evansville, IN-KY Metro Area",315693,2015
21820,"Fairbanks, AK Metro Area",99631,2015
22020,"Fargo, ND-MN Metro Area",233836,2015
22060,"Faribault-Northfield, MN Micro Area",65400,2015
22100,"Farmington, MO Micro Area",66520,2015
22140,"Farmington, NM Metro Area",118737,2015
22180,"Fayetteville, NC Metro Area",376509,2015
22220,"Fayetteville-Springdale-Rogers, AR-MO Metro Area",515403,2015
22300,"Findlay, OH Micro Area",75573,2015
22380,"Flagstaff, AZ Metro Area",139097,2015
22420,"Flint, MI Metro Area",410849,2015
22500,"Florence, SC Metro Area",206448,2015
22520,"Florence-Muscle Shoals, AL Metro Area",146950,2015
22540,"Fond du Lac, WI Metro Area",101973,2015
22580,"Forest City, NC Micro Area",66390,2015
22660,"Fort Collins, CO Metro Area",333577,2015
22900,"Fort Smith, AR-OK Metro Area",280241,2015
23060,"Fort Wayne, IN Metro Area",429820,2015
23180,"Frankfort, KY Micro Area",71505,2015
23420,"Fresno, CA Metro Area",974861,2015
23460,"Gadsden, AL Metro Area",103057,2015
23540,"Gainesville, FL Metro Area",276881,2015
23580,"Gainesville, GA Metro Area",193535,2015
23700,"Gallup, NM Micro Area",76708,2015
23900,"Gettysburg, PA Metro Area",102295,2015
24020,"Glens Falls, NY Metro Area",126918,2015
24060,"Glenwood Springs, CO Micro Area",78056,2015
24140,"Goldsboro, NC Metro Area",124132,2015
24220,"Grand Forks, ND-MN Metro Area",102449,2015
24260,"Grand Island, NE Metro Area",84942,2015
24300,"Grand Junction, CO Metro Area",148513,2015
24340,"Grand Rapids-Wyoming, MI Metro Area",1038583,2015
24420,"Grants Pass, OR Metro Area",84745,2015
24500,"Great Falls, MT Metro Area",82278,2015
24540,"Greeley, CO Metro Area",285174,2015
24580,"Green Bay, WI Metro Area",316519,2015
24620,"Greeneville, TN Micro Area",68580,2015
24640,"Greenfield Town, MA Micro Area",70601,2015
24660,"Greensboro-High Point, NC Metro Area",752157,2015
24780,"Greenville, NC Metro Area",175842,2015
24860,"Greenville-Anderson-Mauldin, SC Metro Area",874869,2015
24940,"Greenwood, SC Micro Area",94211,2015
25020,"Guayama, PR Metro Area",77367,2015
25060,"Gulfport-Biloxi-Pascagoula, MS Metro Area",389255,2015
25180,"Hagerstown-Martinsburg, MD-WV Metro Area",261486,2015
25220,"Hammond, LA Metro Area",128755,2015
25260,"Hanford-Corcoran, CA Metro Area",150965,2015
25420,"Harrisburg-Carlisle, PA Metro Area",565006,2015
25500,"Harrisonburg, VA Metro Area",131131,2015
25540,"Hartford-West Hartford-East Hartford, CT Metro Area",1211324,2015
25620,"Hattiesburg, MS Metro Area",148610,2015
25740,"Helena, MT Micro Area",78834,2015
25840,"Hermiston-Pendleton, OR Micro Area",89094,2015
25860,"Hickory-Lenoir-Morganton, NC Metro Area",362510,2015
25900,"Hilo, HI Micro Area",196428,2015
25940,"Hilton Head Island-Bluffton-Beaufort, SC Metro Area",207413,2015
25980,"Hinesville, GA Metro Area",78811,2015
26020,"Hobbs, NM Micro Area",71180,2015
26090,"Holland, MI Micro Area",114625,2015
26140,"Homosassa Springs, FL Metro Area",141058,2015
26300,"Hot Springs, AR Metro Area",97177,2015
26380,"Houma-Thibodaux, LA Metro Area",212297,2015
26420,"Houston-The Woodlands-Sugar Land, TX Metro Area",6656946,2015
26580,"Huntington-Ashland, WV-KY-OH Metro Area",361580,2015
26620,"Huntsville, AL Metro Area",444752,2015
26660,"Huntsville, TX Micro Area",87693,2015
26740,"Hutchinson, KS Micro Area",63718,2015
26820,"Idaho Falls, ID Metro Area",139849,2015
26860,"Indiana, PA Micro Area",86966,2015
26900,"Indianapolis-Carmel-Anderson, IN Metro Area",1988152,2015
26980,"Iowa City, IA Metro Area",166498,2015
27060,"Ithaca, NY Metro Area",104926,2015
27100,"Jackson, MI Metro Area",159494,2015
27140,"Jackson, MS Metro Area",578561,2015
27180,"Jackson, TN Metro Area",129682,2015
27260,"Jacksonville, FL Metro Area",1449481,2015
27340,"Jacksonville, NC Metro Area",186311,2015
27460,"Jamestown-Dunkirk-Fredonia, NY Micro Area",130779,2015
27500,"Janesville-Beloit, WI Metro Area",161448,2015
27620,"Jefferson City, MO Metro Area",151357,2015
27740,"Johnson City, TN Metro Area",200264,2015
27780,"Johnstown, PA Metro Area",136411,2015
27860,"Jonesboro, AR Metro Area",128394,2015
27900,"Joplin, MO Metro Area",177211,2015
27980,"Kahului-Wailuku-Lahaina, HI Metro Area",164726,2015
28020,"Kalamazoo-Portage, MI Metro Area",335340,2015
28060,"Kalispell, MT Micro Area",96165,2015
28100,"Kankakee, IL Metro Area",110879,2015
28140,"Kansas City, MO-KS Metro Area",2088269,2015
28180,"Kapaa, HI Micro Area",71735,2015
28300,"Keene, NH Micro Area",75909,2015
28420,"Kennewick-Richland, WA Metro Area",279116,2015
28580,"Key West, FL Micro Area",77482,2015
28660,"Killeen-Temple, TX Metro Area",430642,2015
28700,"Kingsport-Bristol-Bristol, TN-VA Metro Area",305929,2015
28740,"Kingston, NY Metro Area",180143,2015
28900,"Klamath Falls, OR Micro Area",66016,2015
28940,"Knoxville, TN Metro Area",861679,2015
29020,"Kokomo, IN Metro Area",82556,2015
29100,"La Crosse-Onalaska, WI-MN Metro Area",136985,2015
29180,"Lafayette, LA Metro Area",490488,2015
29200,"Lafayette-West Lafayette, IN Metro Area",214997,2015
29300,"LaGrange, GA Micro Area",69763,2015
29340,"Lake Charles, LA Metro Area",205493,2015
29380,"Lake City, FL Micro Area",68348,2015
29420,"Lake Havasu City-Kingman, AZ Metro Area",204737,2015
29460,"Lakeland-Winter Haven, FL Metro Area",650092,2015
29540,"Lancaster, PA Metro Area",536624,2015
29620,"Lansing-East Lansing, MI Metro Area",472276,2015
29700,"Laredo, TX Metro Area",269721,2015
29740,"Las Cruces, NM Metro Area",214295,2015
29820,"Las Vegas-Henderson-Paradise, NV Metro Area",2114801,2015
29860,"Laurel, MS Micro Area",85637,2015
29940,"Lawrence, KS Metro Area",118053,2015
30020,"Lawton, OK Metro Area",130581,2015
30140,"Lebanon, PA Metro Area",137067,2015
30300,"Lewiston, ID-WA Metro Area",62153,2015
30340,"Lewiston-Auburn, ME Metro Area",107233,2015
30460,"Lexington-Fayette, KY Metro Area",500535,2015
30620,"Lima, OH Metro Area",104425,2015
30700,"Lincoln, NE Metro Area",323557,2015
30780,"Little Rock-North Little Rock-Conway, AR Metro Area",730250,2015
30860,"Logan, UT-ID Metro Area",133821,2015
30940,"London, KY Micro Area",127953,2015
30980,"Longview, TX Metro Area",217781,2015
31020,"Longview, WA Metro Area",103468,2015
31080,"Los Angeles-Long Beach-Anaheim, CA Metro Area",13340068,2015
31140,"Louisville/Jefferson County, KY-IN Metro Area",1279335,2015
31180,"Lubbock, TX Metro Area",312433,2015
31260,"Lufkin, TX Micro Area",88255,2015
31300,"Lumberton, NC Micro Area",134197,2015
31340,"Lynchburg, VA Metro Area",260504,2015
31420,"Macon, GA Metro Area",231448,2015
31460,"Madera, CA Metro Area",154998,2015
31540,"Madison, WI Metro Area",641385,2015
31700,"Manchester-Nashua, NH Metro Area",406678,2015
31740,"Manhattan, KS Metro Area",98545,2015
31820,"Manitowoc, WI Micro Area",79806,2015
31860,"Mankato-North Mankato, MN Metro Area",99134,2015
31900,"Mansfield, OH Metro Area",121707,2015
31940,"Marinette, WI-MI Micro Area",64432,2015
31980,"Marion, IN Micro Area",67979,2015
32020,"Marion, OH Micro Area",65355,2015
32100,"Marquette, MI Micro Area",67215,2015
32220,"Marshall, TX Micro Area",66746,2015
32300,"Martinsville, VA Micro Area",65553,2015
32420,"Mayagez, PR Metro Area",98464,2015
32580,"McAllen-Edinburg-Mission, TX Metro Area",842304,2015
32740,"Meadville, PA Micro Area",86484,2015
32780,"Medford, OR Metro Area",212567,2015
32820,"Memphis, TN-MS-AR Metro Area",1343572,2015
32900,"Merced, CA Metro Area",268455,2015
32940,"Meridian, MS Micro Area",104782,2015
33100,"Miami-Fort Lauderdale-West Palm Beach, FL Metro Area",6012331,2015
33140,"Michigan City-La Porte, IN Metro Area",110884,2015
33220,"Midland, MI Metro Area",83632,2015
33260,"Midland, TX Metro Area",165427,2015
33340,"Milwaukee-Waukesha-West Allis, WI Metro Area",1575747,2015
33460,"Minneapolis-St. Paul-Bloomington, MN-WI Metro Area",3524583,2015
33500,"Minot, ND Micro Area",80737,2015
33540,"Missoula, MT Metro Area",114181,2015
33660,"Mobile, AL Metro Area",415395,2015
33700,"Modesto, CA Metro Area",538388,2015
33740,"Monroe, LA Metro Area",179238,2015
33780,"Monroe, MI Metro Area",149568,2015
33860,"Montgomery, AL Metro Area",375435,2015
33980,"Morehead City, NC Micro Area",68879,2015
34060,"Morgantown, WV Metro Area",138176,2015
34100,"Morristown, TN Metro Area",116642,2015
34180,"Moses Lake, WA Micro Area",93259,2015
34340,"Mount Airy, NC Micro Area",72743,2015
34380,"Mount Pleasant, MI Micro Area",70698,2015
34580,"Mount Vernon-Anacortes, WA Metro Area",121846,2015
34620,"Muncie, IN Metro Area",116852,2015
34740,"Muskegon, MI Metro Area",172790,2015
34780,"Muskogee, OK Micro Area",69699,2015
34820,"Myrtle Beach-Conway-North Myrtle Beach, SC-NC Metro Area",431964,2015
34860,"Nacogdoches, TX Micro Area",65664,2015
34900,"Napa, CA Metro Area",142456,2015
34940,"Naples-Immokalee-Marco Island, FL Metro Area",357305,2015
34980,"Nashville-Davidson--Murfreesboro--Franklin, TN Metro Area",1830298,2015
35100,"New Bern, NC Metro Area",125066,2015
35260,"New Castle, PA Micro Area",88082,2015
35300,"New Haven-Milford, CT Metro Area",859470,2015
35380,"New Orleans-Metairie, LA Metro Area",1262888,2015
35420,"New Philadelphia-Dover, OH Micro Area",92916,2015
35620,"New York-Newark-Jersey City, NY-NJ-PA Metro Area",20182305,2015
35660,"Niles-Benton Harbor, MI Metro Area",154636,2015
35840,"North Port-Sarasota-Bradenton, FL Metro Area",768918,2015
35900,"North Wilkesboro, NC Micro Area",68502,2015
35980,"Norwich-New London, CT Metro Area",271863,2015
36020,"Oak Harbor, WA Micro Area",80593,2015
36100,"Ocala, FL Metro Area",343254,2015
36140,"Ocean City, NJ Metro Area",94727,2015
36220,"Odessa, TX Metro Area",159436,2015
36260,"Ogden-Clearfield, UT Metro Area",644030,2015
36300,"Ogdensburg-Massena, NY Micro Area",111007,2015
36420,"Oklahoma City, OK Metro Area",1358452,2015
36460,"Olean, NY Micro Area",77922,2015
36500,"Olympia-Tumwater, WA Metro Area",269536,2015
36540,"Omaha-Council Bluffs, NE-IA Metro Area",915557,2015
36660,"Opelousas, LA Micro Area",83848,2015
36700,"Orangeburg, SC Micro Area",89208,2015
36740,"Orlando-Kissimmee-Sanford, FL Metro Area",2387138,2015
36780,"Oshkosh-Neenah, WI Metro Area",169546,2015
36860,"Ottawa-Peru, IL Micro Area",151595,2015
36980,"Owensboro, KY Metro Area",117967,2015
37020,"Owosso, MI Micro Area",68619,2015
37100,"Oxnard-Thousand Oaks-Ventura, CA Metro Area",850536,2015
37140,"Paducah, KY-IL Micro Area",98597,2015
37260,"Palatka, FL Micro Area",72023,2015
37340,"Palm Bay-Melbourne-Titusville, FL Metro Area",568088,2015
37460,"Panama City, FL Metro Area",197723,2015
37620,"Parkersburg-Vienna, WV Metro Area",92776,2015
37860,"Pensacola-Ferry Pass-Brent, FL Metro Area",478043,2015
37900,"Peoria, IL Metro Area",376987,2015
37980,"Philadelphia-Camden-Wilmington, PA-NJ-DE-MD Metro Area",6069875,2015
38060,"Phoenix-Mesa-Scottsdale, AZ Metro Area",4574531,2015
38220,"Pine Bluff, AR Metro Area",94489,2015
38240,"Pinehurst-Southern Pines, NC Micro Area",94352,2015
38300,"Pittsburgh, PA Metro Area",2353045,2015
38340,"Pittsfield, MA Metro Area",127828,2015
38460,"Plattsburgh, NY Micro Area",81251,2015
38540,"Pocatello, ID Metro Area",83744,2015
38660,"Ponce, PR Metro Area",318802,2015
38820,"Port Angeles, WA Micro Area",73486,2015
38860,"Portland-South Portland, ME Metro Area",526295,2015
38900,"Portland-Vancouver-Hillsboro, OR-WA Metro Area",2390244,2015
38940,"Port St. Lucie, FL Metro Area",454846,2015
39020,"Portsmouth, OH Micro Area",76825,2015
39060,"Pottsville, PA Micro Area",144590,2015
39140,"Prescott, AZ Metro Area",222255,2015
39300,"Providence-Warwick, RI-MA Metro Area",1613070,2015
39340,"Provo-Orem, UT Metro Area",585257,2015
39380,"Pueblo, CO Metro Area",163591,2015
39460,"Punta Gorda, FL Metro Area",173115,2015
39500,"Quincy, IL-MO Micro Area",77450,2015
39540,"Racine, WI Metro Area",195080,2015
39580,"Raleigh, NC Metro Area",1273568,2015
39660,"Rapid City, SD Metro Area",145457,2015
39740,"Reading, PA Metro Area",415271,2015
39820,"Redding, CA Metro Area",179533,2015
39900,"Reno, NV Metro Area",451138,2015
39980,"Richmond, IN Micro Area",67001,2015
40060,"Richmond, VA Metro Area",1271142,2015
40080,"Richmond-Berea, KY Micro Area",102997,2015
40140,"Riverside-San Bernardino-Ontario, CA Metro Area",4489159,2015
40220,"Roanoke, VA Metro Area",311901,2015
40260,"Roanoke Rapids, NC Micro Area",72882,2015
40340,"Rochester, MN Metro Area",213873,2015
40380,"Rochester, NY Metro Area",1081954,2015
40420,"Rockford, IL Metro Area",340663,2015
40580,"Rocky Mount, NC Metro Area",148069,2015
40660,"Rome, GA Metro Area",96504,2015
40700,"Roseburg, OR Micro Area",107685,2015
40740,"Roswell, NM Micro Area",65764,2015
40780,"Russellville, AR Micro Area",85103,2015
40900,"Sacramento--Roseville--Arden-Arcade, CA Metro Area",2274194,2015
40980,"Saginaw, MI Metro Area",193307,2015
41060,"St. Cloud, MN Metro Area",194418,2015
41100,"St. George, UT Metro Area",155602,2015
41140,"St. Joseph, MO-KS Metro Area",127421,2015
41180,"St. Louis, MO-IL Metro Area",2812313,2015
41400,"Salem, OH Micro Area",104806,2015
41420,"Salem, OR Metro Area",410091,2015
41500,"Salinas, CA Metro Area",433898,2015
41540,"Salisbury, MD-DE Metro Area",395300,2015
41620,"Salt Lake City, UT Metro Area",1170266,2015
41660,"San Angelo, TX Metro Area",120106,2015
41700,"San Antonio-New Braunfels, TX Metro Area",2381828,2015
41740,"San Diego-Carlsbad, CA Metro Area",3299521,2015
41780,"Sandusky, OH Micro Area",75550,2015
41860,"San Francisco-Oakland-Hayward, CA Metro Area",4656132,2015
41900,"San Germn, PR Metro Area",128611,2015
41940,"San Jose-Sunnyvale-Santa Clara, CA Metro Area",1976836,2015
41980,"San Juan-Carolina-Caguas, PR Metro Area",2200767,2015
42020,"San Luis Obispo-Paso Robles-Arroyo Grande, CA Metro Area",281401,2015
42100,"Santa Cruz-Watsonville, CA Metro Area",274146,2015
42140,"Santa Fe, NM Metro Area",148686,2015
42200,"Santa Maria-Santa Barbara, CA Metro Area",444769,2015
42220,"Santa Rosa, CA Metro Area",502146,2015
42340,"Savannah, GA Metro Area",379199,2015
42540,"Scranton--Wilkes-Barre--Hazleton, PA Metro Area",558166,2015
42620,"Searcy, AR Micro Area",79161,2015
42660,"Seattle-Tacoma-Bellevue, WA Metro Area",3733580,2015
42680,"Sebastian-Vero Beach, FL Metro Area",147919,2015
42700,"Sebring, FL Metro Area",99491,2015
42860,"Seneca, SC Micro Area",75713,2015
42940,"Sevierville, TN Micro Area",95946,2015
43060,"Shawnee, OK Micro Area",71875,2015
43100,"Sheboygan, WI Metro Area",115569,2015
43140,"Shelby, NC Micro Area",96879,2015
43300,"Sherman-Denison, TX Metro Area",125467,2015
43320,"Show Low, AZ Micro Area",108277,2015
43340,"Shreveport-Bossier City, LA Metro Area",443708,2015
43420,"Sierra Vista-Douglas, AZ Metro Area",126427,2015
43580,"Sioux City, IA-NE-SD Metro Area",165491,2015
43620,"Sioux Falls, SD Metro Area",252234,2015
43740,"Somerset, PA Micro Area",75522,2015
43780,"South Bend-Mishawaka, IN-MI Metro Area",320098,2015
43900,"Spartanburg, SC Metro Area",325079,2015
44060,"Spokane-Spokane Valley, WA Metro Area",546807,2015
44100,"Springfield, IL Metro Area",211598,2015
44140,"Springfield, MA Metro Area",631982,2015
44180,"Springfield, MO Metro Area",455074,2015
44220,"Springfield, OH Metro Area",135959,2015
44300,"State College, PA Metro Area",160580,2015
44340,"Statesboro, GA Micro Area",72651,2015
44420,"Staunton-Waynesboro, VA Metro Area",120221,2015
44620,"Stevens Point, WI Micro Area",70408,2015
44660,"Stillwater, OK Micro Area",80850,2015
44700,"Stockton-Lodi, CA Metro Area",726106,2015
44940,"Sumter, SC Metro Area",107480,2015
44980,"Sunbury, PA Micro Area",93246,2015
45060,"Syracuse, NY Metro Area",660458,2015
45180,"Talladega-Sylacauga, AL Micro Area",91770,2015
45220,"Tallahassee, FL Metro Area",378593,2015
45300,"Tampa-St. Petersburg-Clearwater, FL Metro Area",2975225,2015
45460,"Terre Haute, IN Metro Area",172107,2015
45500,"Texarkana, TX-AR Metro Area",151316,2015
45540,"The Villages, FL Metro Area",118891,2015
45780,"Toledo, OH Metro Area",605956,2015
45820,"Topeka, KS Metro Area",233791,2015
45860,"Torrington, CT Micro Area",183603,2015
45900,"Traverse City, MI Micro Area",148334,2015
45940,"Trenton, NJ Metro Area",371398,2015
46020,"Truckee-Grass Valley, CA Micro Area",98877,2015
46060,"Tucson, AZ Metro Area",1010025,2015
46100,"Tullahoma-Manchester, TN Micro Area",102576,2015
46140,"Tulsa, OK Metro Area",980794,2015
46180,"Tupelo, MS Micro Area",139817,2015
46220,"Tuscaloosa, AL Metro Area",241851,2015
46300,"Twin Falls, ID Micro Area",105312,2015
46340,"Tyler, TX Metro Area",222936,2015
46380,"Ukiah, CA Micro Area",87649,2015
46520,"Urban Honolulu, HI Metro Area",998714,2015
46540,"Utica-Rome, NY Metro Area",295600,2015
46660,"Valdosta, GA Metro Area",142202,2015
46700,"Vallejo-Fairfield, CA Metro Area",436092,2015
47020,"Victoria, TX Metro Area",99040,2015
47220,"Vineland-Bridgeton, NJ Metro Area",155854,2015
47260,"Virginia Beach-Norfolk-Newport News, VA-NC Metro Area",1723351,2015
47300,"Visalia-Porterville, CA Metro Area",459863,2015
47380,"Waco, TX Metro Area",262425,2015
47460,"Walla Walla, WA Metro Area",64056,2015
47580,"Warner Robins, GA Metro Area",187953,2015
47700,"Warsaw, IN Micro Area",78620,2015
47900,"Washington-Arlington-Alexandria, DC-VA-MD-WV Metro Area",6098283,2015
47940,"Waterloo-Cedar Falls, IA Metro Area",170612,2015
48020,"Watertown-Fort Atkinson, WI Micro Area",84559,2015
48060,"Watertown-Fort Drum, NY Metro Area",117635,2015
48140,"Wausau, WI Metro Area",135868,2015
48260,"Weirton-Steubenville, WV-OH Metro Area",121403,2015
48300,"Wenatchee, WA Metro Area",116178,2015
48540,"Wheeling, WV-OH Metro Area",144198,2015
48580,"Whitewater-Elkhorn, WI Micro Area",102804,2015
48620,"Wichita, KS Metro Area",644502,2015
48660,"Wichita Falls, TX Metro Area",150780,2015
48700,"Williamsport, PA Metro Area",116048,2015
48900,"Wilmington, NC Metro Area",277969,2015
48980,"Wilson, NC Micro Area",81714,2015
49020,"Winchester, VA-WV Metro Area",133621,2015
49180,"Winston-Salem, NC Metro Area",659330,2015
49220,"Wisconsin Rapids-Marshfield, WI Micro Area",73435,2015
49300,"Wooster, OH Micro Area",116063,2015
49340,"Worcester, MA-CT Metro Area",935536,2015
49420,"Yakima, WA Metro Area",248830,2015
49620,"York-Hanover, PA Metro Area",442867,2015
49660,"Youngstown-Warren-Boardman, OH-PA Metro Area",549885,2015
49700,"Yuba City, CA Metro Area",170955,2015
49740,"Yuma, AZ Metro Area",204275,2015
49780,"Zanesville, OH Micro Area",86290,2015
10140,"Aberdeen, WA Micro Area",71628,2016
10180,"Abilene, TX Metro Area",170860,2016
10300,"Adrian, MI Micro Area",98504,2016
10380,"Aguadilla-Isabela, PR Metro Area",309764,2016
10420,"Akron, OH Metro Area",702221,2016
10460,"Alamogordo, NM Micro Area",65410,2016
10500,"Albany, GA Metro Area",152506,2016
10540,"Albany, OR Metro Area",122849,2016
10580,"Albany-Schenectady-Troy, NY Metro Area",881839,2016
10700,"Albertville, AL Micro Area",95157,2016
10740,"Albuquerque, NM Metro Area",913924,2016
10780,"Alexandria, LA Metro Area",154789,2016
10900,"Allentown-Bethlehem-Easton, PA-NJ Metro Area",835652,2016
11020,"Altoona, PA Metro Area",124650,2016
11100,"Amarillo, TX Metro Area",263491,2016
11180,"Ames, IA Metro Area",97090,2016
11260,"Anchorage, AK Metro Area",402557,2016
11460,"Ann Arbor, MI Metro Area",364709,2016
11500,"Anniston-Oxford-Jacksonville, AL Metro Area",114611,2016
11540,"Appleton, WI Metro Area",234079,2016
11640,"Arecibo, PR Metro Area",185250,2016
11700,"Asheville, NC Metro Area",452319,2016
11780,"Ashtabula, OH Micro Area",98231,2016
11900,"Athens, OH Micro Area",66186,2016
11980,"Athens, TX Micro Area",79901,2016
12020,"Athens-Clarke County, GA Metro Area",206360,2016
12060,"Atlanta-Sandy Springs-Roswell, GA Metro Area",5790210,2016
12100,"Atlantic City-Hammonton, NJ Metro Area",270991,2016
12180,"Auburn, NY Micro Area",77861,2016
12220,"Auburn-Opelika, AL Metro Area",158991,2016
12260,"Augusta-Richmond County, GA-SC Metro Area",595147,2016
12300,"Augusta-Waterville, ME Micro Area",120569,2016
12420,"Austin-Round Rock, TX Metro Area",2056405,2016
